Title,Year,Language,Genre,Production Company,Runtime (mins),Budget (INR),Director,Lead Cast,Release Date (India),MPAA Rating
Jannat,2008,Hindi,"Crime, Drama, Romance",Vishesh Films,140,,Kunal Deshmukh,"Emraan Hashmi, Sonal Chauhan, Javed Sheikh",16-05-2008,UA
Bunty Aur Babli,2005,Hindi,"Comedy, Crime, Romance",Yash Raj Films,170,,Shaad Ali,"Abhishek Bachchan, Rani Mukerji, Amitabh Bachchan",27-05-2005,N/A
Jayantabhai Ki Luv Story,2013,Hindi,"Action, Comedy, Romance, Drama",Tips Industries,130,,Vinnil Markan,"Vivek Oberoi, Neha Sharma, Zakir Hussain",15-02-2013,UA
Minus 31: The Nagpur Files,2023,Hindi,"Mystery, Drama, Music, Thriller","orangepixel studios, Dragon Water Films, Darshani Entertainment",134,,Pratik Moitro,"Rucha Inamdar, Raghubir Yadav, Kaam bhaari",21-07-2023,A
Rukh,2017,Hindi,"Mystery, Drama","Drishyam Films, Eros International",106,,Atanu Mukherjee,"Manoj Bajpayee, Adarsh Gourav, Smita Tambe",27-10-2017,UA
Tera Intezaar,2017,Hindi,"Thriller, Romance",Bageshree Films,108,,Raajeev Walia,"Arbaaz Khan, Sunny Leone, Arya Babbar",01-12-2017,N/A
Chaarfutiya Chhokare,2014,Hindi,"Drama, Thriller",,119,,Manish Harishankar,"Soha Ali Khan, Zakir Hussain, Seema Biswas",26-09-2014,N/A
Satyaprem Ki Katha,2023,Hindi,"Drama, Romance","Nadiadwala Grandson Entertainment, Namah Pictures",146,,Sameer Vidwans,"Kartik Aaryan, Kiara Advani, Gajraj Rao",29-06-2023,N/A
Thalaivii,2021,Hindi,Drama,"Karma Media and Entertainment, Vibri Media, Gothic Entertainment, Sprint Films, Zee Studios",153,,A. L. Vijay,"Kangana Ranaut, Arvind Swamy, Nassar",10-09-2021,U
"Good Boy, Bad Boy",2007,Hindi,"Comedy, Romance",Mukta Arts Ltd,115,"32,56,50,000",Ashwini Chaudhary,"Tusshar Kapoor, Emraan Hashmi, Isha Sharvani",11-05-2007,U
Heropanti,2014,Hindi,"Romance, Action",Nadiadwala Grandson Entertainment,146,"35,07,00,000",Sabbir Khan,"Tiger Shroff, Kriti Sanon, Prakash Raj",23-05-2014,UA
Veerey Ki Wedding,2018,Hindi,Comedy,,131,,Ashu Trikha,"Pulkit Samrat, Jimmy Shergill, Kriti Kharbanda",02-03-2018,N/A
The Killer,2006,Hindi,Drama,Vishesh Films,122,,Raksha Mistry,"Irrfan Khan, Emraan Hashmi, Priyanka Kothari",21-07-2006,A
Housefull 3,2016,Hindi,"Comedy, Romance",,140,"1,08,55,00,000",Farhad Samji,"Akshay Kumar, Abhishek Bachchan, Riteish Deshmukh",03-06-2016,UA
Summer 2007,2008,Hindi,Drama,,166,,Sohail Tatari,"Yuvika Chaudhary, Arjan Bajwa, Gul Panag",13-06-2008,N/A
Hawaa Hawaai,2014,Hindi,"Drama, Family","Fox Star Studios, Amole Gupte Cinema",120,"12,19,10,000",Amole Gupte,"Makrand Deshpande, Partho A. Gupte, Neha Joshi",09-05-2014,U
Main Zaroor Aaunga,2019,Hindi,"Drama, Horror, Thriller",,100,,Chandrakant Singh,"Arbaaz Khan, Govind Namdeo, Hemant Pandey",27-09-2019,A
Sacred Evil â A True Story,2006,Hindi,"Drama, Horror","Sahara One Motion Pictures, Undercover Productions",109,,Abhiyan Rajhans,"Sarika, Lynsey Pow, Frédéric Andrau",02-06-2006,N/A
Mandali,2023,Hindi,Drama,,118,,'Om' Rakesh Chaturvedi,,,
Ahista Ahista,2006,Hindi,"Drama, Romance",Anjum Rizvi Film Company,123,,Shivam Nair,"Abhay Deol, Soha Ali Khan, Shayan Munshi",18-08-2006,U
Housefull,2010,Hindi,"Comedy, Romance",Nadiadwala Grandson Entertainment,135,"29,22,50,000",Sajid Khan,"Akshay Kumar, Arjun Rampal, Riteish Deshmukh",30-04-2010,UA
Kick,2014,Hindi,"Action, Romance, Comedy, Crime","Nadiadwala Grandson Entertainment, UTV Motion Pictures",146,"1,83,70,00,000",Sajid Nadiadwala,"Salman Khan, Jacqueline Fernandez, Randeep Hooda",25-07-2014,U
Dabangg,2010,Hindi,"Action, Comedy, Crime","Arbaaz Khan Productions, Shree Ashtavinayak Cine Vision",130,"78,23,95,000",Abhinav Kashyap,"Salman Khan, Sonakshi Sinha, Arbaaz Khan",10-09-2010,UA
Mere Brother Ki Dulhan,2011,Hindi,"Drama, Comedy, Romance",Yash Raj Films,139,"46,00,85,000",Ali Abbas Zafar,"Ali Zafar, Imran Khan, Katrina Kaif",09-09-2011,U
Mulk,2018,Hindi,,,4,,David Esposito,Lauren LaVera,,
Karthik Calling Karthik,2010,Hindi,"Romance, Thriller","Eros International, Excel Entertainment",135,"23,38,00,000",Vijay Lalwani,"Farhan Akhtar, Deepika Padukone, Ram Kapoor",26-02-2010,U
Badlapur Boys,2014,Hindi,Drama,,0,,,"Annu Kapoor, Anupam Maanav, Saranya Mohan",12-12-2014,N/A
Dus,2005,Hindi,"Action, Crime, Thriller",,146,,Anubhav Sinha,"Sanjay Dutt, Abhishek Bachchan, Suniel Shetty",08-07-2005,N/A
Future To Bright Hai Ji,2012,Hindi,Drama,,117,,Sanjay Amar,"Aamir Bashir, Sonal Sehgal, Govardhan Asrani",02-11-2012,N/A
Gold,2018,Hindi,"Drama, History","Excel Entertainment, Eros International, Friday Filmworks, Hari Om Entertainment Company",170,,Reema Kagti,"Akshay Kumar, Mouni Roy, Kumud Pant",15-08-2018,UA
Jai Ho,2014,Hindi,"Action, Drama","Eros International, Sohail Khan Production",145,,Sohail Khan,"Salman Khan, Tabu, Danny Denzongpa",24-01-2014,UA
Guest iin London,2017,Hindi,"Comedy, Drama","World Cinema Partners, Kiaan Entertainment, Panorama Studios",132,,Ashwni Dhir,"Kartik Aaryan, Kriti Kharbanda, Paresh Rawal",,
Chhichhore,2019,Hindi,"Romance, Comedy, Drama","Fox Star Studios, Nadiadwala Grandson Entertainment",146,"56,98,87,500",Nitesh Tiwari,"Sushant Singh Rajput, Shraddha Kapoor, Tahir Raj Bhasin",05-09-2019,U
Taare Zameen Par,2007,Hindi,Drama,"Aamir Khan Productions, PVR Inox Pictures, UTV Motion Pictures",162,"21,71,00,000",Aamir Khan,"Darsheel Safary, Aamir Khan, Tisca Chopra",21-12-2007,U
Baadshaho,2017,Hindi,"Action, Thriller","Vertex Motion Pictures, T-Series",136,"1,02,70,50,000",Milan Luthria,"Ajay Devgn, Ileana D'Cruz, Emraan Hashmi",01-09-2017,UA
Halkaa,2018,Hindi,Drama,Akshay Parija Productions,114,,Nila Madhab Panda,"Paoli Dam, Vipin Katyal, Ranvir Shorey",07-09-2018,N/A
Fredrick,2016,Hindi,"Action, Thriller",,129,,Rajesh Butalia,"Prashant Narayanan, Avinash Dhyani, Tulna Butalia",27-05-2016,N/A
Thackeray,2019,Hindi,"Drama, History","Viacom18 Studios, Rauters Entertainment, Carnival Motion Pictures",139,,Abhijit Panse,"Nawazuddin Siddiqui, Amrita Rao, Sudhir Mishra",25-01-2019,UA
Socha Na Tha,2005,Hindi,"Drama, Comedy, Romance",Vijayta Films,145,"12,52,50,000",Imtiaz Ali,"Abhay Deol, Ayesha Takia, Suresh Oberoi",04-03-2005,U
Yaaram,2019,Hindi,,Yashvvi Films,110,,Ovais Khan,"Siddhanth Kapoor, Prateik Smita Patil, Anita Raj",18-10-2019,U
The Film Emotional Atyachar,2010,Hindi,"Thriller, Comedy",,0,"5,54,23,376",Akshay Shere,"Nassar Abdulla, Mohit Ahlawat, Snehal Dabi",03-09-2010,N/A
Yaariyan,2014,Hindi,"Drama, Romance",T-Series,145,835,Divya Khossla,"Himansh Kohli, Nicole Faria, Gulshan Grover",10-01-2014,N/A
Bombairiya,2019,Hindi,"Comedy, Crime, Drama","Beautiful Bay Entertainment, Kreo Films",108,,Pia Sukanya,"Radhika Apte, Akshay Oberoi, Ravi Kishan",11-01-2019,UA
Parched,2016,Hindi,Drama,,5,,Raven Krogstad,"Victoria Clare, Christopher lee lopez",,
Waarrior Savitri,2016,Hindi,"Thriller, Action",,120,,Param Gill,"Om Puri, Lucy Pinder, Gulshan Grover",22-07-2016,N/A
Help,2010,Hindi,"Drama, Horror, Thriller",,110,,Rajeev Virani,"Bobby Deol, Mugdha Godse, Sophia Handa",13-08-2010,N/A
1971,2007,Hindi,"Action, War, Drama","Sagar Pictures Entertainment, Viacom18 Studios",160,,Amrit Sagar Chopra,"Manoj Bajpayee, Ravi Kishan, Sunil Chavan",08-03-2007,Everyone
Desi Boyz,2011,Hindi,"Comedy, Drama","Eros International, Next Gen Films",122,,Rohit Dhawan,"Akshay Kumar, John Abraham, Deepika Padukone",25-11-2011,A
My Friend Pinto,2011,Hindi,Comedy,"Bhansali Productions, UTV Motion Pictures, Prime Focus",115,,Raaghav Dar,"Prateik Smita Patil, Kalki Koechlin, Arjun Mathur",14-10-2011,N/A
Angel,2011,Hindi,,,70,,Sebastiano d'Ayala Valva,,,
Love in Bombay,2013,Hindi,,,0,,Joy Mukherjee,"Joy Mukherjee, Waheeda Rehman, Zeenat Aman",02-08-2013,UA
De Dana Dan,2009,Hindi,"Comedy, Crime","Venus Records & Tapes, Eros Worldwide",166,"66,80,00,000",Priyadarshan,"Akshay Kumar, Suniel Shetty, Katrina Kaif",27-11-2009,UA
Vaada Raha,2009,Hindi,Drama,Top Angle Productions,105,,Samir Karnik,"Bobby Deol, Kangana Ranaut, Dwij Yadav",11-09-2009,U
Mujib: The Making of a Nation,2023,Hindi,"Drama, History, War","Bangladesh Film Development Corporation, National Film Development Corporation of India",176,"66,80,00,000",Shyam Benegal,"Arifin Shuvo, Nusrat Imrose Tisha, Nusraat Faria Mazhar",27-10-2023,N/A
Chance Pe Dance,2010,Hindi,"Music, Romance, Drama",UTV Motion Pictures,121,,Ken Ghosh,"Shahid Kapoor, Genelia D'Souza, Satish Shah",15-01-2010,U
Union Leader,2018,Hindi,,,,,,,,
Maan Gaye Mughal-e-Azam,2008,Hindi,,Venus Records & Tapes,137,,Sanjay Chel,"Rahul Bose, Paresh Rawal, Mallika Sherawat",21-08-2008,U
Jazbaa,2015,Hindi,"Thriller, Action",White Feather Films,119,,Sanjay Gupta,"Aishwarya Rai Bachchan, Irrfan Khan, Shabana Azmi",09-10-2015,N/A
Anjaana Anjaani,2010,Hindi,"Comedy, Drama, Romance","Curbside Films, Eros Worldwide, Nadiadwala Grandson Entertainment",151,"53,44,00,000",Siddharth Anand,"Priyanka Chopra Jonas, Ranbir Kapoor, Zayed Khan",01-10-2010,UA
Rashmi Rocket,2021,Hindi,Drama,"RSVP Movies, Mango People Media",129,,Akarsh Khurana,"Taapsee Pannu, Priyanshu Painyuli, Abhishek Banerjee",,
The Great Leader Kanshiram,2017,Hindi,,,0,,Arjun Singh,,10-02-2017,N/A
Love Hostel,2022,Hindi,"Crime, Romance, Thriller","Red Chillies Entertainment, Drishyam Films, Reflection Pictures Studio",101,,Shanker Raman,"Vikrant Massey, Sanya Malhotra, Bobby Deol",,
Dabangg,2010,Hindi,"Action, Comedy, Crime","Arbaaz Khan Productions, Shree Ashtavinayak Cine Vision",130,"78,23,95,000",Abhinav Kashyap,"Salman Khan, Sonakshi Sinha, Arbaaz Khan",10-09-2010,UA
Ghost,2012,Hindi,Horror,,0,,Puja Bedi,"Shiney Ahuja, Sayali Bhagat, Rahul Roy",13-01-2012,N/A
Mitron,2018,Hindi,"Romance, Comedy, Family",Abundantia Entertainment,116,,Nitin Kakkar,"Jacky Bhagnani, Kritika Kamra, Prateik Smita Patil",,
Shahid,2013,Hindi,"Drama, Crime","Anurag Kashyap Films, Bohra Bros Productions, Paramhans Creations",129,"8,09,95,000",Hansal Mehta,"Rajkummar Rao, Kay Kay Menon, Tigmanshu Dhulia",18-10-2013,N/A
Hunterrr,2015,Hindi,"Drama, Romance","A Tailormade Films, Phantom Films",141,,Harshavardhan Kulkarni,"Gulshan Devaiah, Radhika Apte, Sai Tamhankar",20-03-2015,A
Apaharan,2005,Hindi,"Action, Crime, Drama",,173,,Prakash Jha,"Ajay Devgn, Nana Patekar, Bipasha Basu",02-12-2005,N/A
Fan,2016,Hindi,"Action, Adventure, Thriller","Red Chillies Entertainment, Yash Raj Films, Prime Focus",138,"1,06,46,25,000",Maneesh Sharma,"Shah Rukh Khan, Deepika Amin, Yogendra Tiku",14-04-2016,UA
Rock On!!,2008,Hindi,Drama,"Excel Entertainment, Reliance Entertainment",144,"58,45,00,000",Abhishek Kapoor,"Farhan Akhtar, Arjun Rampal, Purab Kohli",29-08-2008,U
Manmarziyaan,2018,Hindi,"Romance, Drama","Phantom Films, Colour Yellow Productions, Eros International",155,,Anurag Kashyap,"Taapsee Pannu, Abhishek Bachchan, Vicky Kaushal",21-09-2018,UA
Shaabash! You Can Do It[13],2009,Hindi,,,,,,,,
Singham,2011,Hindi,"Drama, Action, Crime",Reliance Entertainment,143,"40,08,00,000",Rohit Shetty,"Ajay Devgn, Kajal Aggarwal, Prakash Raj",22-07-2011,UA
Station,2014,Hindi,"Crime, Drama, Thriller",Sumit Ghosh Media,103,,Saad Khan,"Sameer Kevin Roy, K. S. Siddhanth, Hardik Sha",28-03-2014,N/A
Force 2,2016,Hindi,"Action, Adventure, Crime","JA Entertainment, Sunshine Pictures, Viacom18 Studios",123,"54,27,50,000",Abhinay Deo,"John Abraham, Sonakshi Sinha, Raj Babbar",18-11-2016,UA
Miss Tanakpur Haazir Ho,2015,Hindi,,,0,,Vinod Kapri,"Rahul Bagga, Hrishitaa Bhatt, Annu Kapoor",26-06-2015,A
I Hate Luv Storys,2010,Hindi,"Comedy, Drama, Romance","Dharma Productions, UTV Motion Pictures",129,"36,74,00,000",Punit Malhotra,"Imran Khan, Sonam Kapoor Ahuja, Sammir Dattani",02-07-2010,UA
Ek Ladki Ko Dekha Toh Aisa Laga,2019,Hindi,"Romance, Drama","Vidhu Vinod Chopra Productions, Rajkumar Hirani Films, Fox Star Studios",121,,Shelly Chopra Dhar,"Sonam Kapoor Ahuja, Anil Kapoor, Juhi Chawla Mehta",01-02-2019,UA
Mere Dad Ki Maruti,2013,Hindi,Comedy,Y-Films,101,,Ashima Chibber,"Saqib Saleem, Rhea Chakraborty, Ram Kapoor",15-03-2013,PG
Chintu Ji,2009,Hindi,"Comedy, Drama",,115,,Ranjit Kapoor,"Rishi Kapoor, Priyanshu Chatterjee, Kulraj Randhawa",04-09-2009,U
Namastey London,2007,Hindi,"Comedy, Drama, Romance","Blockbuster Movie Entertainers, Ultra Media & Entertainment [IN], Namastey London Productions Limited, Eros International",131,,Vipul Amrutlal Shah,"Akshay Kumar, Katrina Kaif, Rishi Kapoor",23-03-2007,UA
Chopsticks,2019,Hindi,"Comedy, Animation, Thriller",Compute Company,1,,,Jimmy Xiang,,
D Day,2013,Hindi,"Action, Thriller","DAR Motion Pictures, Emmay Entertainment",153,"32,56,50,000",Nikkhil Advani,"Irrfan Khan, Arjun Rampal, Rishi Kapoor",19-07-2013,UA
Chase,2010,Hindi,"Action, Crime, Drama",,0,,Jag Mundhra,"Anuj Saxena, Udita Goswami, Tarina Patel",30-04-2010,N/A
Hazaaron Khwaishein Aisi,2005,Hindi,,,,,,,,
Chicken Curry Law,2019,Hindi,"Crime, Thriller, Drama",Panorama Studios,127,,Shekhar Sirrinn,"Nivedita Bhattacharya, Ashutosh Rana, Makrand Deshpande",09-08-2019,A
Jai Veeru,2009,Hindi,"Action, Adventure, Crime, Thriller",Siddhi Vinayak Movies,160,,Puneet Sira,"Kunal Khemu, Fardeen Khan, Dia Mirza",13-03-2009,UA
Golmaal Again,2017,Hindi,"Comedy, Horror, Action, Fantasy","Reliance Entertainment, Rohit Shetty Productionz, Ajay Devgn FFilms",151,"70,14,00,000",Rohit Shetty,"Ajay Devgn, Arshad Warsi, Tusshar Kapoor",20-10-2017,UA
Irada,2017,Hindi,Thriller,,109,,Aparna Singh,"Arshad Warsi, Naseeruddin Shah, Sharad Kelkar",17-02-2017,UA
Jo Bole So Nihaal,2005,Hindi,"Action, Comedy",,127,,Rahul Rawail,"Sunny Deol, Shillpi Sharma, Kamaal Khan",13-05-2005,N/A
Fever,2016,Hindi,"Mystery, Crime",,105,,Rajeev Jhaveri,"Rajeev Khandelwal, Gauahar Khan, Gemma Atkinson",05-08-2016,N/A
99,2009,Hindi,"Comedy, Crime",People Pictures,141,"25,05,00,000",Krishna D.K.,"Kunal Khemu, Boman Irani, Soha Ali Khan",15-05-2009,N/A
Operation Mayfair,2023,Hindi,"Crime, Thriller",,116,,Sudipto Sarkar,"Jimmy Shergill, Vedieka Dutt, Ankur Bhatia",24-03-2023,A
Once Upon ay Time in Mumbai Dobaara!,2013,Hindi,,,,,,,,
Baaghi 2,2018,Hindi,"Action, Crime, Adventure, Mystery, Thriller","Benetone Films, Fox Star Studios, Nadiadwala Grandson Entertainment",145,,Ahmed Khan,"Tiger Shroff, Disha Patani, Manoj Bajpayee",30-03-2018,UA
Shree,2013,Hindi,,,0,,Rajesh Bachchani,"Hussain Kuwajerwala, Paresh Ganatra, Anjali Patil",26-04-2013,U
Chak De! India,2007,Hindi,Drama,"Yash Raj Films, Film Victoria",148,"52,60,50,000",Shimit Amin,"Shah Rukh Khan, Vidya Malvade, Sagarika Ghatge",10-08-2007,U
Laal Rang,2016,Hindi,"Comedy, Crime, Drama, Thriller",Krian Media,147,,Syed Ahmad Afzal,"Randeep Hooda, Pia Bajpiee, Rajneesh Duggal",22-04-2016,UA
Munna Mange Memsaab,2014,Hindi,,,145,,Shareeph Mansuri Saranawala,"Omkar Das Manikpuri, Razak Khan, Jordiya Anna",11-07-2014,N/A
Laal Singh Chaddha,2022,Hindi,"Drama, Romance, Family, History","Aamir Khan Productions, Viacom18 Studios, Paramount Pictures",164,"1,92,05,00,000",Advait Chandan,"Aamir Khan, Kareena Kapoor Khan, Naga Chaitanya Akkineni",11-08-2022,UA
Challo Driver,2012,Hindi,"Romance, Comedy",,95,,,"Kainaz Motivala, Vickrant Mahajan, Prem Chopra",20-07-2012,N/A
Jeena Hai Toh Thok Daal,2012,Hindi,Drama,,123,,Manish Vatsalya,"Ravi Kishan, Manish Vatsalya, Hazel Crowney",14-09-2012,N/A
Bhaiaji Superhit,2018,Hindi,"Action, Thriller, Comedy",Daily Multimedia Limited,139,,Neeraj Pathak,"Sunny Deol, Preity Zinta, Arshad Warsi",23-11-2018,UA
Nazar Andaaz,2022,Hindi,"Comedy, Drama","T-Series, Kathputli Creations",103,,Vikrant Deshmukh,"Kumud Mishra, Divya Dutta, Abhishek Banerjee",07-10-2022,N/A
Bang Bang!,2014,Hindi,"Action, Adventure, Comedy, Romance, Thriller","Fox Star Studios, Benetone Films, Fox International Productions India, Milk & Honey Pictures",153,,Siddharth Anand,"Hrithik Roshan, Katrina Kaif, Danny Denzongpa",02-10-2014,UA
Ferrari Ki Sawaari,2012,Hindi,"Family, Comedy",Vidhu Vinod Chopra Productions,140,,Rajesh Mapuskar,"Sharman Joshi, Ritwik Sahore, Boman Irani",15-06-2012,N/A
Kacchey Limbu,2023,Hindi,,,,,,,,
Kyaa Kool Hai Hum,2005,Hindi,Comedy,,172,,Sangeeth Sivan,"Tusshar Kapoor, Riteish Deshmukh, Isha Koppikar",,
India's Most Wanted,2019,Hindi,"Action, Thriller","Fox Star Studios, Raapchik Films",123,,Raj Kumar Gupta,"Arjun Kapoor, Rajesh Sharma, Gaurav Mishra",24-05-2019,UA
Kissebaaz,2019,Hindi,Drama,"Experion Moviez, PVR Inox Pictures",123,,Annant Jaaitpaal,"Pankaj Tripathi, Rahul Bagga, Anupriya Goenka",14-06-2019,UA
Tiku Weds Sheru,2023,Hindi,"Comedy, Drama, Family",Manikarnika Films,111,,Sai Kabir,"Nawazuddin Siddiqui, Avneet Kaur, Akshat Jain",,
Dhamaka,2021,Hindi,"Thriller, Drama, Crime","RSVP Movies, Ram Madhvani Films, Globalgate Entertainment, Lotte Entertainment, Lotte Cultureworks",104,,Ram Madhvani,"Kartik Aaryan, Amruta Subhash, Mrunal Thakur",,
Souten: The Other Woman,2006,Hindi,Thriller,,180,,Karan Razdan,"Mahima Chaudhry, Padmini Kolhapure, Kiran Rathod",24-03-2006,N/A
Shivaay,2016,Hindi,"Adventure, Action, Drama, Thriller","NH Studioz, Pen India Limited, Eros International, Ajay Devgn FFilms",153,,Ajay Devgn,"Ajay Devgn, Abigail Eames, Erika Kaar",28-10-2016,UA
Jackpot,2013,Hindi,"Comedy, Thriller",Viiking Media & Entertainment,132,,Kaizad Gustad,"Makrand Deshpande, Sachiin Joshi, Sunny Leone",13-12-2013,A
Players,2012,Hindi,"Action, Adventure, Crime, Thriller, Drama","Viacom18 Studios, Burmawala Partners, Globus-film, Prime Focus",163,,Abbas Alibhai Burmawalla,"Abhishek Bachchan, Sonam Kapoor Ahuja, Bobby Deol",06-01-2012,UA
Gattu,2012,Hindi,,,,,,,,
Padmashree Laloo Prasad Yadav,2005,Hindi,,,0,,Mahesh Manjrekar,"Suniel Shetty, Masumeh Makhija, Anupama Verma",28-01-2005,N/A
NH-8 Road to Nidhivan,2015,Hindi,,,0,,,Auroshikha Dey,17-04-2015,N/A
Do Knot Disturb,2009,Hindi,"Comedy, Romance",,126,,David Dhawan,"Govinda, Sushmita Sen, Lara Dutta",,
My Father Iqbal,2016,Hindi,Drama,,104,,Suzad Iqbal Khan,"Narendra Jha, Komal Thacker",21-10-2016,N/A
Satyameva Jayate 2,2021,Hindi,"Action, Crime, Drama, Thriller","Emmay Entertainment, T-Series",141,"23,79,75,000",Milap Zaveri,"John Abraham, Divya Khossla, Nora Fatehi",25-11-2021,UA
Operation Romeo,2022,Hindi,"Drama, Thriller","E4 Entertainments, Friday Filmworks, Plan C Studios, Reliance Entertainment",135,,Shashant Shah,"Sidhant Gupta, Vedika Pinto, Sharad Kelkar",22-04-2022,UA
Phir Se...,2018,Hindi,"Comedy, Drama","Intercut Entertainment, Pen Studios, Sunny Sounds",147,,Navaniat Singh,"Dharmendra, Sunny Deol, Bobby Deol",31-08-2018,UA
Bhoot Returns,2012,Hindi,Horror,"Eros Entertainment, Alumbra Entertainment",73,"6,26,25,000",Ram Gopal Varma,"Manisha Koirala, J. D. Chakravarthi, Madhu Shalini",11-10-2012,A
Wake Up Sid,2009,Hindi,"Comedy, Drama, Romance",Dharma Productions,138,"25,05,00,000",Ayan Mukerji,"Ranbir Kapoor, Konkona Sen Sharma, Rahul Khanna",02-10-2009,UA
Haddi,2023,Hindi,"Drama, Crime","Zee Studios, Anandita Studios",134,,Akshat Ajay Sharma,"Nawazuddin Siddiqui, Anurag Kashyap, Shreedhar Dubey",,
Shor in the City,2011,Hindi,"Crime, Drama","Cult Movies, Balaji Motion Pictures",107,,Raj Nidimoru,"Sundeep Kishan, Tusshar Kapoor, Sendhil Ramamurthy",28-04-2011,N/A
The Japanese Wife,2010,Hindi,"Drama, Romance",Saregama Films,105,,Aparna Sen,"Rahul Bose, Raima Sen, Chigusa Takaku",09-04-2010,N/A
Kaalakaandi,2018,Hindi,"Comedy, Thriller, Drama","Flying Unicorn Entertainment, Cinestaan Film Company",112,,Akshat Verma,"Saif Ali Khan, Akshay Oberoi, Isha Talwar",12-01-2018,A
Chaar Din Ki Chandni,2012,Hindi,"Comedy, Romance",,119,,Samir Karnik,"Rana Jung Bahadur, Anupam Kher, Tusshar Kapoor",09-03-2012,N/A
Babloo Happy Hai,2014,Hindi,"Comedy, Drama, Romance",,113,,Nila Madhab Panda,"Sahil Anand, Parvin Dabas, Erica Fernandes",07-02-2014,N/A
Evening Shadows,2019,Hindi,,,,,,,,
Mummy Punjabi,2011,Hindi,,,116,,,"Kirron Kher, Kanwaljit Singh, Jackie Shroff",31-08-2011,N/A
Murder 2,2011,Hindi,"Action, Crime, Drama, Thriller","Vishesh Films, Prime Focus",127,,Mohit Suri,"Emraan Hashmi, Prashant Narayanan, Jacqueline Fernandez",08-07-2011,A
Ram Ki Janmabhoomi,2019,Hindi,,,0,,,,29-03-2019,U
Salaam Venky,2022,Hindi,Drama,"Blive Productions, R Take Studios, Connekkt Media",131,,Revathi,"Vishal Jethwa, Kajol, Aahana Kumra",09-12-2022,UA
Chamku,2008,Hindi,"Action, Crime, Romance, Thriller","Vijayta Films, Vainteya",105,,Kabeer Kaushik,"Bobby Deol, Priyanka Chopra Jonas, Riteish Deshmukh",29-08-2008,A
1920: The Evil Returns,2012,Hindi,"Thriller, Horror, Romance",ASA Productions and Enterprises,130,,Bhushan Patel,"Aftab Shivdasani, Tia Bajpai, Vidya Malvade",02-11-2012,A
Welcome Back,2015,Hindi,"Action, Comedy",Base Industries Group,153,,Anees Bazmee,"John Abraham, Shruti Haasan, Anil Kapoor",04-09-2015,UA
Satrangee Parachute,2011,Hindi,,,120,,Vineet Khetrapal,,25-02-2011,N/A
Banjo,2016,Hindi,"Music, Action","Eros International, Eros International",140,,Ravi Jadhav,"Riteish Deshmukh, Nargis Fakhri, Aditya Kumar",23-09-2016,N/A
Beehad - The Ravines,2013,Hindi,,,,,,,,
PK,2014,Hindi,"Comedy, Drama, Science Fiction","Rajkumar Hirani Films, Vinod Chopra Films, UTV Motion Pictures",153,"1,08,55,00,000",Rajkumar Hirani,"Aamir Khan, Anushka Sharma, Saurabh Shukla",19-12-2014,UA
Good Newwz,2019,Hindi,"Romance, Comedy, Family, Drama","Dharma Productions, Cape Of Good Films, Zee Studios",132,,Raj Mehta,"Akshay Kumar, Diljit Dosanjh, Kareena Kapoor Khan",27-12-2019,UA
Project Marathwada,2016,Hindi,Drama,Eagle Eye Entertainment,102,,Bhavin Wadia,"Om Puri, Seema Biswas, Govind Namdeo",03-06-2016,N/A
B.A. Pass,2013,Hindi,,,,,,,,
Coffee with D,2017,Hindi,Comedy,,123,,Vishal Mishra,"Sunil Grover, Anjana Sukhani, Zakir Hussain",20-01-2017,A
Pyaar Mein Twist,2005,Hindi,"Music, Comedy, Drama",,123,,Hriday Shetty,"Rishi Kapoor, Dimple Kapadia, Kishori Shahane",02-09-2005,N/A
Dasvi,2022,Hindi,"Drama, Comedy","Jio Studios, Maddock Films, Bake My Cake Films",127,,Tushar Jalota,"Abhishek Bachchan, Yami Gautam, Nimrat Kaur",,
Ra.One,2011,Hindi,"Adventure, Action, Science Fiction","Red Chillies Entertainment, Eros International, Prime Focus",156,"2,00,40,00,000",Anubhav Sinha,"Shah Rukh Khan, Arjun Rampal, Kareena Kapoor Khan",26-10-2011,U
Heyy Babyy,2007,Hindi,"Comedy, Drama, Romance",Nadiadwala Grandson Entertainment,150,"78,49,00,000",Sajid Khan,"Akshay Kumar, Riteish Deshmukh, Fardeen Khan",24-08-2007,UA
Lage Raho Munna Bhai,2006,Hindi,"Comedy, Drama, Romance",Vidhu Vinod Chopra Productions,144,"15,03,00,000",Rajkumar Hirani,"Sanjay Dutt, Arshad Warsi, Dilip Prabhavalkar",,
Humshakals,2014,Hindi,Comedy,"Fox Star Studios, Pooja Entertainment",160,,Sajid Khan,"Saif Ali Khan, Riteish Deshmukh, Ram Kapoor",20-06-2014,UA
Bank Chor,2017,Hindi,"Comedy, Crime, Thriller",Y-Films,129,,Bumpy,"Vivek Oberoi, Riteish Deshmukh, Rhea Chakraborty",16-06-2017,UA
Partner,2007,Hindi,"Comedy, Romance","Eros International, Sohail Khan Production",143,,David Dhawan,"Salman Khan, Govinda, Lara Dutta",20-07-2007,UA
Mom,2017,Hindi,Romance,,71,,Kwak Yeong-geun,"Kim In-ae, Choi Woo-suk-I, Eom Gi-yeong",,
Veer,2010,Hindi,"Action, Romance",Eros International,160,"10,43,75,000",Anil Sharma,"Salman Khan, Mithun Chakraborty, Jackie Shroff",26-01-2010,UA
Sooryavanshi,2021,Hindi,"Action, Crime, Thriller","Reliance Entertainment, Dharma Productions, Rohit Shetty Productionz",145,"1,08,55,00,000",Rohit Shetty,"Akshay Kumar, Katrina Kaif, Javed Jaffrey",05-11-2021,UA
Khajoor Pe Atke,2018,Hindi,Comedy,Welcome Friends Productions,119,,Harsh Chhaya,"Vinay Pathak, Manoj Pahwa, Suneeta Sengupta",18-05-2018,UA
Ishqeria,2018,Hindi,"Comedy, Romance",,118,,Prerna Wadhawan,"Neil Nitin Mukesh, Richa Chadha, Gurbani Judge",21-09-2018,N/A
Antardwand,2010,Hindi,Drama,,114,"1,75,35,000",Sushil Rajpal,"Raj Singh Chaudhary, Swati Sen, Akhilendra Mishra",,
Roohi,2021,Hindi,"Horror, Comedy","Maddock Films, Jio Studios",134,"34,23,50,000",Hardik Mehta,"Rajkummar Rao, Varun Sharma, Janhvi Kapoor",11-03-2021,UA
Yuvvraaj,2008,Hindi,Drama,"Eros International, Mukta Arts Ltd",159,,Subhash Ghai,"Salman Khan, Anil Kapoor, Katrina Kaif",21-11-2008,U
Desi Kattey,2014,Hindi,"Action, Drama",,139,,Anand Kumar,"Akhil Kapur, Jay Bhanushali, Suniel Shetty",26-09-2014,UA
Force,2011,Hindi,"Action, Crime, Drama, Thriller",,137,,Nishikant Kamat,"John Abraham, Genelia D'Souza, Raj Babbar",30-09-2011,UA
Morning Raga,2005,Hindi,,,,,,,,
Aashayein,2010,Hindi,Drama,,115,,Nagesh Kukunoor,"John Abraham, Sonal Sehgal, Anaitha Nair",27-08-2010,N/A
Shaurya,2008,Hindi,"Drama, Thriller",Moser Baer,145,,Samar Khan,"Kay Kay Menon, Rahul Bose, Amrita Rao",04-04-2008,A
Dhaakad,2022,Hindi,"Action, Thriller","Soham Rockstar Entertainment, Asylum Films, Sohel Maklai Productions, Zee Studios",131,"91,20,56,973",Razneesh Ghai,"Kangana Ranaut, Arjun Rampal, Divya Dutta",20-05-2022,A
Almost Pyaar with DJ Mohabbat,2023,Hindi,"Romance, Drama, Music","Zee Studios, Good Bad Films",119,,Anurag Kashyap,"Alaya F, Karan Mehta, Sapna Pabbi",03-02-2023,UA
Gaslight,2023,Hindi,,,73,,Na'Im Freeman,,,
Hawaizaada,2015,Hindi,"Drama, Fantasy, History","Reliance Entertainment, Trilogic Digital Media, Film Farmers Production",157,"29,22,50,000",Vibhu Puri,"Ayushmann Khurrana, Mithun Chakraborty, Jeffrey Goldberg",30-01-2015,U
Thoda Pyaar Thoda Magic,2008,Hindi,"Drama, Comedy",Yash Raj Films,145,,Kunal Kohli,"Rani Mukerji, Saif Ali Khan, Ameesha Patel",,
Teree Sang,2009,Hindi,"Romance, Drama",Karol Bagh Film & Entertainment,132,"13,79,88,008",Satish Kaushik,"Ruslaan Mumtaz, Anupam Kher, Satish Kaushik",,
Sukhee,2023,Hindi,"Comedy, Drama","Abundantia Entertainment, T-Series",139,,Sonal Joshi,"Shilpa Shetty Kundra, Chaitannya Choudhry, Maahi Jain",22-09-2023,N/A
Happy New Year,2014,Hindi,"Action, Comedy, Crime, Adventure","Red Chillies Entertainment, Yash Raj Films",180,"2,08,75,00,000",Farah Khan,"Shah Rukh Khan, Sonu Sood, Deepika Padukone",24-10-2014,U
Shabd,2005,Hindi,"Romance, Thriller",,140,"20,87,50,000",Leena Yadav,"Sanjay Dutt, Aishwarya Rai Bachchan, Zayed Khan",04-02-2005,N/A
Masaan,2015,Hindi,Drama,"Sikhya Entertainment, Drishyam Films, Phantom Films, Macassar Productions, ARTE France Cinéma",109,,Neeraj Ghaywan,"Richa Chadha, Sanjay Mishra, Vicky Kaushal",24-07-2015,A
