Title,Year,Language,Genre,Production Company,Runtime (mins),Budget (INR),Director,Lead Cast,Release Date (India),MPAA Rating
Kahin Hai Mera Pyar,2014,Hindi,"Drama, Music, Romance",,138,,Mahesh Vaijnath Doijode,"Gajendra Chouhan, Sanjay Kapoor, Jackie Shroff",01-05-2014,N/A
Hichki,2018,Hindi,"Drama, Comedy",Yash Raj Films,116,"16,70,00,000",Siddharth P. Malhotra,"Rani Mukerji, Neeraj Kabi, Rohit Saraf",23-03-2018,N/A
Soch Lo,2010,Hindi,"Action, Mystery, Thriller",,0,,,,27-09-2010,N/A
Chala Mussaddi... Office Office,2011,Hindi,"Drama, Comedy",,100,,,"Deven Bhojani, Manoj Pahwa, Sanjay Mishra",05-08-2011,N/A
Lucky: No Time for Love,2005,Hindi,"Drama, Romance",Sohail Khan Production,180,,Radhika Rao,"Salman Khan, Sneha Ullal, Mithun Chakraborty",08-04-2005,U
Mera Fauji Calling,2021,Hindi,,,,,,,,
Lust Stories,2018,Hindi,"Drama, Romance","RSVP Movies, Flying Unicorn Entertainment, Tiger Baby",120,,Karan Johar,"Kiara Advani, Radhika Apte, Akash Thosar",,
Bodyguard,2011,Hindi,"Drama, Action, Romance","Reel Life Productions, Reliance Entertainment, Funky Buddha Productions",134,,Siddique,"Salman Khan, Kareena Kapoor Khan, Hazel Keech",31-08-2011,UA
Bumboo,2012,Hindi,Comedy,,126,,Jagdish Rajpurohit,"Kavin Dave, Mandy Takhar, Sanjay Mishra",30-03-2012,N/A
Satya Sai Baba,2021,Hindi,,,,,,,,
Aashiqui 2,2013,Hindi,"Drama, Romance","T-Series, Vishesh Films",132,"10,85,50,000",Mohit Suri,"Aditya Roy Kapur, Shraddha Kapoor, Shaad Randhawa",26-04-2013,U
"Saheb, Biwi Aur Gangster",2011,Hindi,"Drama, Action, Thriller, Crime, Romance","Brandsmith Motion Pictures, Tigmanshu Dhulia Films",119,,Tigmanshu Dhulia,"Jimmy Shergill, Mahie Gill, Randeep Hooda",23-09-2011,N/A
Radhe Shyam[a],2022,Hindi,"Drama, Romance","UV Creations, T-Series, MSK Films",138,,Radha Krishna Kumar,"Prabhas, Pooja Hegde, Sachin Khedekar",11-03-2022,UA
Race 3,2018,Hindi,"Thriller, Action, Crime, Adventure","Salman Khan Films, Tips Industries",160,,Remo D'Souza,"Salman Khan, Anil Kapoor, Bobby Deol",15-06-2018,UA
Nil Battey Sannata,2016,Hindi,"Drama, Family","Colour Yellow Productions, Jar Pictures, Opticus, Sandman Pictures",100,,Ashwiny Iyer Tiwari,"Swara Bhasker, Ratna Pathak Shah, Pankaj Tripathi",22-04-2016,N/A
Chup: Revenge of the Artist,2022,Hindi,"Crime, Thriller",Hope Productions,130,,R. Balki,"Dulquer Salmaan, Shreya Dhanwanthary, Sunny Deol",23-09-2022,A
Uri: The Surgical Strike,2019,Hindi,"Action, Drama, War",RSVP Movies,138,,Aditya Dhar,"Vicky Kaushal, Paresh Rawal, Yami Gautam",11-01-2019,UA
One by Two,2014,Hindi,"Comedy, Drama, Romance",Viacom18 Studios,139,,Devika Bhagat,"Abhay Deol, Preeti Desai, Tahir Raj Bhasin",31-01-2014,UA
Commando 2,2017,Hindi,"Action, Thriller","Sunshine Pictures, Pen India Limited",123,,Deven Bhojani,"Vidyut Jammwal, Adah Sharma, Freddy Daruwala",02-03-2017,UA
Sarkar Raj,2008,Hindi,"Action, Adventure, Crime, Drama","K Sera Sera Limited, Z Picture Company, Balaji Motion Pictures",125,"6,84,70,000",Ram Gopal Varma,"Amitabh Bachchan, Abhishek Bachchan, Aishwarya Rai Bachchan",06-06-2008,UA
Khiladi 786,2012,Hindi,"Action, Comedy",Hari Om Entertainment,139,,Ashish R. Mohan,"Akshay Kumar, Asin Thottumkal, Himesh Reshammiya",,
Love Ka Tadka[12],2009,Hindi,,,,,,,,
CityLights,2014,Hindi,"Thriller, Drama",Vishesh Films,126,"7,01,40,000",Hansal Mehta,"Rajkummar Rao, Manav Kaul, Pramod Pathak",30-05-2014,UA
Badrinath Ki Dulhania,2017,Hindi,"Drama, Comedy, Romance",Dharma Productions,139,,Shashank Khaitan,"Varun Dhawan, Alia Bhatt, Shweta Basu Prasad",10-03-2017,UA
Mumbai Mirror,2013,Hindi,"Action, Crime, Thriller",,136,,Ankush Bhatt,"Sachiin Joshi, Prakash Raj, Vimala Raman",18-01-2013,N/A
Ghazi,2017,Hindi,"Action, War, Thriller, History","Matinee Entertainment, PVP Cinema",126,"15,86,50,000",Sankalp Reddy,"Kay Kay Menon, Rana Daggubati, Atul Kulkarni",17-02-2017,UA
"Shahrukh Bola ""Khoobsurat Hai Tu""",2010,Hindi,"Comedy, Drama",RSB Films,89,,Makrand Deshpande,"Afzaal Khan, Preetika Chawla, Makrand Deshpande",19-11-2010,U
Mother Teresa & Me,2023,Hindi,,,,,,,,
Loveyatri,2018,Hindi,"Drama, Romance, Comedy, Music",Salman Khan Films,140,,Abhiraj Minawala,"Aayush Sharma, Warina Hussain, Kamil Lemieszewski",05-10-2018,UA
Sixteen,2013,Hindi,Thriller,Seize Films,80,,Rob Brown,"Roger Jean Nsengiyumva, Rachael Stirling, Fady Elsayed",,
Pyaar Ka Punchnama,2011,Hindi,"Drama, Comedy, Romance",,149,"11,69,00,000",Luv Ranjan,"Kartik Aaryan, Raayo S. Bakhirta, Divyendu Sharma",20-05-2011,N/A
Chashme Baddoor,2013,Hindi,"Comedy, Drama",Viacom18 Studios,120,"3,08,95,00,000",David Dhawan,"Ali Zafar, Taapsee Pannu, Siddharth",05-04-2013,N/A
Wah Taj,2016,Hindi,"Comedy, Drama",Pun Films Pvt. Ltd SpyderWave Films,125,,Ajit Sinha,"Shreyas Talpade, Manjari Fadnnis, Hemant Pandey",23-09-2016,U
Via Darjeeling,2008,Hindi,"Thriller, Drama, Mystery","Moxie Entertainments Private, National Film Development Corporation of India",104,,Arindam Nandy,"Kay Kay Menon, Sonali Kulkarni, Parvin Dabas",21-11-2008,N/A
Khap,2011,Hindi,Drama,,0,,,,01-08-2011,MA
Pusher,2010,Hindi,"Action, Crime, Drama","Vertigo Films, Embargo Films",107,,Assad Raja,"Assad Raja, Pasha Bocarie, Mahima Chaudhry",,
Badmashiyaan,2015,Hindi,"Comedy, Romance",,128,,Amit Khanna,"Sidhant Gupta, Gunjan Malhotra, Suzanna Mukherjee",06-03-2015,N/A
Kucch Luv Jaisaa,2011,Hindi,"Drama, Crime",,102,,Barnali Ray Shukla,"Rahul Bose, Shefali Shah, Neetu Chandra",27-05-2011,N/A
Crazy Cukkad Family,2015,Hindi,Comedy,Prakash Jha Productions,0,,Ritesh Menon,"Swanand Kirkire, Shilpa Shukla, Kushal Punjabi",15-01-2015,N/A
Notebook,2019,Hindi,"Romance, Drama","Salman Khan Films, Cine1 Studios",115,,Nitin Kakkar,"Pranutan Bahl, Zaheer Iqbal, Farhana Bhat",29-03-2019,U
Super 30,2019,Hindi,Drama,"Phantom Films, Nadiadwala Grandson Entertainment, Reliance Entertainment, HRX Films",153,,Vikas Bahl,"Hrithik Roshan, Mrunal Thakur, Veerendra Saxena",12-07-2019,U
Begum Jaan,2017,Hindi,"Action, Drama, History","Vishesh Films, Play Entertainment, SVF Entertainment",128,,Srijit Mukherji,"Vidya Balan, Naseeruddin Shah, Ridheema Tiwari",14-04-2017,A
Bullet: Ek Dhamaka,2005,Hindi,"Action, Drama",Diana S. Films,137,,Irfan Khan,"Saayli Buva, Natalya Gudkova, Iqbal Khan",05-02-2005,UA
Mod,2011,Hindi,"Romance, Drama",,136,,B. V. Nandini Reddy,"Nani, Nithya Menen, Rohini",21-01-2011,U
Action Replayy,2010,Hindi,"Comedy, Romance, Science Fiction","Hari Om Entertainment, Blockbuster Movie Entertainers, PVR Inox Pictures",100,"83,50,00,000",Vipul Amrutlal Shah,"Akshay Kumar, Aishwarya Rai Bachchan, Aditya Roy Kapur",05-11-2010,UA
Kabir Singh,2019,Hindi,"Drama, Romance","Cine1 Studios, T-Series",172,"73,07,08,500",Sandeep Reddy Vanga,"Shahid Kapoor, Kiara Advani, Arjan Bajwa",21-06-2019,A
Manjunath,2014,Hindi,Drama,,0,,Sandeep A. Verma,"Anjori Alagh, Seema Biswas, Divya Dutta",09-05-2014,N/A
Why Cheat India,2019,Hindi,"Drama, Crime","Ellipsis Entertainment, Emraan Hashmi Films, T-Series",121,,Soumik Sen,"Emraan Hashmi, Shreya Dhanwanthary, Ammar Taalwala",18-01-2019,UA
Patel Ki Punjabi Shaadi,2017,Hindi,Comedy,,120,,,"Paresh Rawal, Rishi Kapoor, Payal Ghosh",15-09-2017,N/A
Chehraa,2005,Hindi,"Drama, Thriller",Khwaish Movies,136,,Saurabh Shukla,"Bipasha Basu, Dino Morea, Preeti Jhangiani",18-02-2005,UA
Hello,2008,Hindi,Comedy,"Funky Buddha Media, Mirah Entertainment, Perception Pictures, Reel Life Productions",129,,Atul Agnihotri,"Sharman Joshi, Sohail Khan, Isha Koppikar",10-10-2008,UA
Barfi!,2012,Hindi,"Drama, Romance, Comedy","Ishana Movies, UTV Motion Pictures",151,"37,05,31,918",Anurag Basu,"Ranbir Kapoor, Priyanka Chopra Jonas, Ileana D'Cruz",14-09-2012,U
12th Fail,2023,Hindi,Drama,"Vidhu Vinod Chopra Productions, Zee Studios, KRG Studios",146,"20,04,00,000",Vidhu Vinod Chopra,"Vikrant Massey, Medha Shankr, Anant Joshi",27-10-2023,N/A
Bhanwarey,2017,Hindi,Comedy,,120,,Shaurya Singh,"Shaurya Singh, Karhan Dev, Jashan Singh",24-03-2017,N/A
Nail Polish,2021,Hindi,"Crime, Thriller, Drama",Ten Years Younger Productions,128,,Bugs Bhargava Krishna,"Arjun Rampal, Manav Kaul, Madhoo",,
Lafangey Parindey,2010,Hindi,"Action, Drama, Romance",Yash Raj Films,126,"37,57,50,000",Pradeep Sarkar,"Neil Nitin Mukesh, Deepika Padukone, Kay Kay Menon",20-08-2010,UA
Woh Lamhe...,2006,Hindi,"Drama, Romance",Vishesh Films,132,,Mohit Suri,"Kangana Ranaut, Shiney Ahuja, Shaad Randhawa",26-09-2006,A
Rangrezz,2013,Hindi,"Action, Drama",Pooja Entertainment,143,,Priyadarshan,"Jacky Bhagnani, Priya Anand, Rajpal Yadav",21-03-2013,UA
Ek Kahani Julie Ki,2016,Hindi,"Crime, Drama, Thriller",,140,,Aziz Zee,"Rakhi Sawant, Amit Mehra, Jimmy Sharma",09-09-2016,N/A
Daas Dev,2018,Hindi,"Thriller, Drama","Saptrishi Cinevision, Storm Motion Pictures",160,,Sudhir Mishra,"Rahul Bhat, Aditi Rao Hydari, Richa Chadha",23-03-2018,UA
Pal Pal Dil Ke Paas,2019,Hindi,Romance,"Sunny Sounds, Vijayta Films, Zee Studios",144,,Sunny Deol,"Karan Deol, Sahher Bambba, Simone Singh",20-09-2019,N/A
Machine,2017,Hindi,"Action, Romance, Comedy",Abbas Mustan Film Productions Pvt Ltd,148,"32,16,24,048",Abbas Alibhai Burmawalla,"Mustafa Burmawala, Kiara Advani, Rishabh Arora",17-03-2017,N/A
Chaalis Chauraasi,2012,Hindi,"Crime, Drama, Thriller",,115,,Hriday Shetty,"Naseeruddin Shah, Kay Kay Menon, Atul Kulkarni",13-01-2012,N/A
UT69,2023,Hindi,Drama,"SVS Studio, The Bigger Picture",140,,Shanawaz Ali,"Raj Kundra, Kumar Saurabh, Gaurav Mishra",03-11-2023,N/A
Mr. Bhatti on Chutti,2012,Hindi,,,0,,,"Bhairavi Goswami, Shakti Kapoor, Amaan Irees",18-05-2012,N/A
Dhoom 2,2006,Hindi,"Drama, Action, Thriller, Crime","Yash Raj Films, Dhoom Studios",151,"91,85,00,000",Sanjay Gadhvi,"Hrithik Roshan, Abhishek Bachchan, Aishwarya Rai Bachchan",24-11-2006,UA
Hichki,2018,Hindi,"Drama, Comedy",Yash Raj Films,116,"16,70,00,000",Siddharth P. Malhotra,"Rani Mukerji, Neeraj Kabi, Rohit Saraf",23-03-2018,N/A
Gulmohar,2023,Hindi,"Drama, Comedy",Satyajit Ray Film & Television Institute,20,"3,34,000",Digvijay Andhorikar,"Amol Nikhare, Sangeita Inamdar-Kulkarni, Mrinmoyee Biswas",,
Music Teacher,2019,Hindi,,,,,,,,
Do Ajnabee,2023,Hindi,,,89,,Sanjeev Kumar rajput,"Arya Babbar, Aman Verma, Anu Mitra",24-11-2023,N/A
Garam Masala,2005,Hindi,Comedy,Venus Records & Tapes,142,,Priyadarshan,"Akshay Kumar, John Abraham, Paresh Rawal",,
EMI - Liya Hai Toh Chukana Parega,2008,Hindi,,,,,,,,
Don 2,2011,Hindi,"Action, Thriller","Excel Entertainment, Red Chillies Entertainment, Landmark Productions, Pixion Studio",139,"91,85,00,000",Farhan Akhtar,"Shah Rukh Khan, Priyanka Chopra Jonas, Boman Irani",23-12-2011,UA
Utthaan,2006,Hindi,,,134,,Ujjal Chatterjee,"Priyanshu Chatterjee, Neha Dhupia, Sana Khaan",13-10-2006,N/A
Riyasat,2014,Hindi,Crime,,80,,Ashok Tyagi,"Rajesh Khanna, Raza Murad, Vishwajeet Pradhan",18-07-2014,N/A
Panchlait,2017,Hindi,Drama,,120,"26,35,260",Prem Prakash Modi,"Nayna Bandhopadhyay, Brijendra Kala, Rajesh Sharma",17-11-2017,N/A
Horror Story,2013,Hindi,Horror,ASA Production & Enterprises,91,,Ayush Raina,"Aparnaa Bajpai, Ravish Desai, Karan Kundra",13-09-2013,U
Shaadi Karke Phas Gaya Yaar,2006,Hindi,Drama,Karishma International,152,,K. S. Adiyaman,"Salman Khan, Shilpa Shetty Kundra, Reema Lagoo",04-08-2006,U
Happy Husbands,2011,Hindi,Comedy,,134,,Jaiveer,Kurush Deboo,25-03-2011,N/A
Dishoom,2016,Hindi,"Comedy, Action","Nadiadwala Grandson Entertainment, Eros International",120,,Rohit Dhawan,"John Abraham, Varun Dhawan, Akshaye Khanna",29-07-2016,UA
Koi Jaane Na,2021,Hindi,"Thriller, Mystery","T-Series, Amin Hajee Film Company",141,,Amin Hajee,"Kunal Kapoor, Amyra Dastur, Karim Hajee",02-04-2021,UA
Bhavesh Joshi Superhero,2018,Hindi,"Action, Drama",Phantom Films,155,,Vikramaditya Motwane,"Harshvardhan Kapoor, Priyanshu Painyuli, Dhritiman Chatterjee",01-06-2018,UA
Mumbai Can Dance Saala,2015,Hindi,,,,,,,,
Deewana Main Deewana,2013,Hindi,"Comedy, Romance, Thriller",,107,,K. C. Bokadia,"Govinda, Priyanka Chopra Jonas, Prem Chopra",01-02-2013,N/A
Blank,2019,Hindi,Drama,"Invictus Film, Odense Filmværksted",17,,David Silset,"Ingrid-Marie Thorlacius Troelsen, Peter Schlie Hansen, Niklas Herskind",,
Paan Singh Tomar,2012,Hindi,"Crime, Drama","UTV Motion Pictures, UTV Spotboy Motion Pictures",135,,Tigmanshu Dhulia,"Irrfan Khan, Mahie Gill, Vipin Sharma",02-03-2012,N/A
Mittal v/s Mittal,2010,Hindi,Drama,Shaila Films Productions,135,,Karan Razdan,"Rohit Roy, Rituparna Sengupta, Gulshan Grover",26-03-2010,UA
Jhund,2022,Hindi,Drama,"T-Series, Tandav Films Entertainment, Aatpat Production",178,,Nagraj Popatrao Manjule,"Amitabh Bachchan, Ankush Gedam, Rinku Rajguru",04-03-2022,UA
Bluffmaster!,2005,Hindi,"Drama, Comedy, Romance","Sahara One Entertainment, Ramesh Sippy Entertainment",137,"15,22,33,192",Rohan Sippy,"Abhishek Bachchan, Riteish Deshmukh, Priyanka Chopra Jonas",16-12-2005,UA
Sau Jhooth Ek Sach,2005,Hindi,Thriller,,0,,Bappaditya Bandopadhyay,"Mammootty, Vikram Gokhale, Lillete Dubey",16-09-2005,U
Total Dhamaal,2019,Hindi,"Comedy, Adventure","Anand Pandit Motion Pictures, Fox Star Studios, Maruti International, Shri Adhikari Brothers, Reliance Entertainment, Ajay Devgn FFilms",127,,Indra Kumar,"Ajay Devgn, Riteish Deshmukh, Arshad Warsi",22-02-2019,U
Saare Jahaan Se Mehnga,2013,Hindi,"Comedy, Drama",,120,,Anshul Sharma,"Sanjay Mishra, Zakir Hussain, Disha Pandey",08-03-2013,U
I See You,2006,Hindi,"Romance, Drama","Chasing Ganesha Films, K Sera Sera Limited",122,,Vivek B Agrawal,"Arjun Rampal, Vipasha Agarwal, Boman Irani",29-12-2006,U
Aggar,2007,Hindi,"Drama, Romance, Thriller",Siddhi Vinayak Creations,125,,Ananth Narayan Mahadevan,"Tusshar Kapoor, Udita Goswami, Shreyas Talpade",14-09-2007,N/A
Chhoriyan Chhoron Se Kam Nahi Hoti,2019,Hindi,"Action, Drama",Zee Studios,114,,Rajesh Babbar,"Annirudh Dave, Rashmi Singh Somvanshi, Sapna Choudhary",17-05-2019,U
Queen,2014,Hindi,"Comedy, Drama","Phantom Films, Viacom18 Studios",146,"15,86,50,000",Vikas Bahl,"Kangana Ranaut, Rajkummar Rao, Lisa Haydon",07-03-2014,U
Kajarya,2015,Hindi,Drama,"STAR FIRE MOVIES, Ekaa Films Pvt. Ltd",132,,Madhureeta Anand,"Sumeet Vyas, Ridhima Sud, Manoj Bakshi",04-12-2015,A
Ajay Wardhan,2022,Hindi,,,122,"3,03,94,000",Pragati Agarwal,"Romil Chaudhary, Priya Sharma, Ruslaan Mumtaz",16-12-2022,N/A
Bal Ganesh,2007,Hindi,"Animation, Family",,106,,Panjak Sharma,"Kailash Kher, Asha Bhosle",,
Kuchh Meetha Ho Jaye,2005,Hindi,"Drama, Comedy, Romance",Shemaroo Entertainment,130,,Samar Khan,"Arshad Warsi, Mahima Chaudhry, Parvin Dabas",15-04-2005,U
Jaane Hoga Kya,2006,Hindi,"Action, Romance, Science Fiction, Thriller",,0,,Ankush Glen,"Bipasha Basu, Preeti Jhangiani, Rahul Dev",31-08-2006,N/A
Anjaana Anjaani,2010,Hindi,"Comedy, Drama, Romance","Curbside Films, Eros Worldwide, Nadiadwala Grandson Entertainment",151,"53,44,00,000",Siddharth Anand,"Priyanka Chopra Jonas, Ranbir Kapoor, Zayed Khan",01-10-2010,UA
Shabri,2011,Hindi,"Crime, Drama, Action",Reliance Entertainment,129,,Lalit Marathe,"Isha Koppikar, Zakir Hussain, Pradeep Ram Singh Rawat",08-11-2011,UA
Bombay Talkies,2013,Hindi,"Drama, Romance",Viacom18 Studios,127,"91,85,00,000",Zoya Akhtar,"Rani Mukerji, Randeep Hooda, Saqib Saleem",03-05-2013,UA
Raabta,2017,Hindi,"Romance, Thriller","Maddock Films, Illuminati Films Pvt Ltd",147,,Dinesh Vijan,"Sushant Singh Rajput, Kriti Sanon, Jim Sarbh",08-06-2017,UA
Omkara,2006,Hindi,"Crime, Drama","Big Screen Entertainment, Shemaroo Entertainment, Eros International",155,,Vishal Bhardwaj,"Ajay Devgn, Saif Ali Khan, Kareena Kapoor Khan",28-07-2006,A
Khandaani Shafakhana,2019,Hindi,"Comedy, Drama",,136,,Shilpi Dasgupta,"Sonakshi Sinha, Varun Sharma, Annu Kapoor",02-08-2019,UA
Fox,2009,Hindi,"Action, Thriller",Tijori Entertainment,0,,Deepak Tijori,"Sunny Deol, Arjun Rampal, Sagarika Ghatge",04-09-2009,N/A
Honeymoon Travels Pvt. Ltd.,2007,Hindi,"Comedy, Drama, Romance",Excel Entertainment,118,"11,69,00,000",Reema Kagti,"Shabana Azmi, Boman Irani, Ameesha Patel",23-02-2007,UA
Ahaan,2021,Hindi,"Comedy, Drama",Will Finds Way Films,81,,Nikhil Pherwani,"Arif Zakaria, Niharika Singh, Abuli Mamaji",19-03-2021,N/A
36 China Town,2006,Hindi,"Comedy, Thriller",Mukta Arts Ltd,140,,Mustan Alibhai Burmawalla,"Akshaye Khanna, Shahid Kapoor, Kareena Kapoor Khan",21-04-2006,UA
"Saheb, Biwi Aur Gangster Returns",2013,Hindi,"Thriller, Drama, Action, Crime","Tigmanshu Dhulia Films, Brandsmith Motion Pictures, Select Media Holdings- Moving Pictures",139,,Tigmanshu Dhulia,"Irrfan Khan, Jimmy Shergill, Soha Ali Khan",08-03-2013,A
Bollywood Diaries,2016,Hindi,Drama,"Eagle Eye Entertainment, Rehab Pictures Private Limited",123,,K. D. Satyam,"Raima Sen, Salim Diwan, Ashish Vidhyarthi",26-02-2016,N/A
Meeruthiya Gangster,2015,Hindi,"Crime, Comedy",Friday To Friday Entertainers,129,,Zeishan Quadri,"Aakash Dahiya, Jatin Sarna, Jaideep Ahlawat",18-09-2015,UA
Rabba Main Kya Karoon,2013,Hindi,Comedy,,0,,Amrit Sagar Chopra,"Arshad Warsi, Paresh Rawal, Shakti Kapoor",02-08-2013,N/A
3 Storeys,2018,Hindi,Drama,"B4U Television Network, Excel Entertainment",100,,Arjun Mukerjee,"Pulkit Samrat, Richa Chadha, Sharman Joshi",09-03-2018,N/A
Fanaa,2006,Hindi,"Action, Drama, Romance, Thriller",Yash Raj Films,168,"44,25,50,000",Kunal Kohli,"Aamir Khan, Kajol, Rishi Kapoor",,
"Gandhi, My Father",2007,Hindi,"Drama, History",Anil Kapoor Film & Communication Network,136,,Feroz Abbas Khan,"Akshaye Khanna, Darshan Jariwala, Bhumika Chawla",03-08-2007,N/A
Cash,2021,Hindi,"Comedy, Drama",Va Va Voom,119,,Rishab Seth,"Amol Parashar, Smriti Kalra, Kavin Dave",,
Sona Spa,2013,Hindi,Drama,,102,,Makrand Deshpande,"Naseeruddin Shah, Aahana Kumra, Shruti Vyas",22-03-2013,A
Yeh Jawaani Hai Deewani,2013,Hindi,"Romance, Comedy","Dharma Productions, UTV Motion Pictures, Eros International",160,"64,29,50,000",Ayan Mukerji,"Ranbir Kapoor, Deepika Padukone, Aditya Roy Kapur",31-05-2013,UA
Bawri Chhori,2021,Hindi,,,0,,,"Aahana Kumra, Niki Aneja Walia, Vikram Kochhar",19-02-2021,N/A
Waiting,2015,Hindi,Horror,PizzaCake,3,,,,,
Ship of Theseus,2013,Hindi,,,,,,,,
Kal Kissne Dekha,2009,Hindi,"Drama, Comedy, Romance",Pooja Entertainment,124,"20,56,188",Vivek Sharma,"Jacky Bhagnani, Vaishali Desai, Rishi Kapoor",,
Goodbye,2022,Hindi,Romance,,13,,Baker Ahmed,"Ahmed Ziyad, Othman Ahmed, Yhya Hamed",,
High Jack,2018,Hindi,Comedy,Phantom Films,0,,Akarsh Khurana,"Sumeet Vyas, Ross Bucharn, Nipun Dharmadhikari",20-04-2018,N/A
Golmaal Returns,2008,Hindi,Comedy,Shree Ashtavinayak Cine Vision,136,"35,07,00,000",Rohit Shetty,"Ajay Devgn, Arshad Warsi, Shreyas Talpade",29-10-2008,UA
Ishqedarriyaan,2015,Hindi,Romance,,132,,V. K. Prakash,"Mimoh Chakraborty, Evelyn Sharma, Kavin Dave",29-05-2015,U
Horn 'Ok' Pleassss,2009,Hindi,,,,,,,,
Tanu Weds Manu,2011,Hindi,"Comedy, Romance, Drama","Sanjay Singh Films, Viacom18 Studios, Soundarya production",119,"3,34,00,000",Aanand L. Rai,"R. Madhavan, Kangana Ranaut, Jimmy Shergill",25-02-2011,UA
Water,2007,Hindi,,,0,,,Roger Waters,,
Koyelaanchal,2014,Hindi,,,146,,Ashu Trikha,"Vinod Khanna, Roopali Krishnarao, Suniel Shetty",,
Great Grand Masti,2016,Hindi,"Comedy, Fantasy, Horror",Balaji Motion Pictures,127,,Indra Kumar,"Riteish Deshmukh, Vivek Oberoi, Aftab Shivdasani",15-07-2016,A
Son Of Sardaar,2012,Hindi,"Action, Comedy, Romance","Viacom18 Studios, Ajay Devgn FFilms",141,"35,90,50,000",Ashwni Dhir,"Ajay Devgn, Sonakshi Sinha, Sanjay Dutt",13-11-2012,UA
Jaane Tu... Ya Jaane Na,2008,Hindi,"Drama, Comedy, Romance","PVR Inox Pictures, Aamir Khan Productions",155,"19,20,50,000",Abbas Tyrewala,"Imran Khan, Genelia D'Souza, Manjari Fadnnis",04-07-2008,N/A
Bombay Rose,2021,Hindi,,,,,,,,
Wanted,2009,Hindi,"Action, Comedy, Crime, Thriller","Sahara One Motion Pictures, BSK Network and Entertainment",155,,Prabhu Deva,"Salman Khan, Vinod Khanna, Ayesha Takia",18-09-2009,A
Sardar Ka Grandson,2021,Hindi,"Comedy, Drama, Romance, Family","T-Series, Emmay Entertainment, JA Entertainment",140,,Kaashvie Nair,"Arjun Kapoor, Neena Gupta, Rakul Preet Singh",,
Gang of Ghosts,2014,Hindi,"Comedy, Horror",Venus Records & Tapes,128,,Satish Kaushik,"Sharman Joshi, Mahie Gill, Anupam Kher",21-03-2014,UA
Singh Saab The Great,2013,Hindi,"Action, Drama",,134,,Anil Sharma,"Sunny Deol, Amrita Rao, Prakash Raj",22-11-2013,N/A
Dream Girl,2019,Hindi,"Animation, Drama",Waadi Animations,15,,Sharmeen Obaid-Chinoy,,,
Murari the Mad Gentleman,2016,Hindi,,,,,,,,
Partner,2007,Hindi,"Comedy, Romance","Eros International, Sohail Khan Production",143,,David Dhawan,"Salman Khan, Govinda, Lara Dutta",20-07-2007,UA
Jalwa - Fun in Love[6],2005,Hindi,,,,,,,,
Tadap,2021,Hindi,"Action, Romance","Nadiadwala Grandson Entertainment, Fox Star Studios, Vertex Motion Pictures",126,,Milan Luthria,"Ahan Shetty, Tara Sutaria, Saurabh Shukla",03-12-2021,UA
The Lady Killer,2023,Hindi,"Thriller, Crime","SCIPL, Karma Media and Entertainment, Polaroid Media, Jussawala Productions LLP, Movies N More",125,"45,12,71,241",Ajay Bahl,"Bhumi Pednekar, Arjun Kapoor, Priyanka Bose",03-11-2023,A
Sadda Adda,2012,Hindi,,,0,,,"Karan Sharma, Shaurya Chauhan, Bhaumik Sampat",13-01-2012,N/A
RK/RKay,2022,Hindi,,,,,,,,
Dansh,2005,Hindi,"Action, Animation, Comedy",Toei Animation,91,,Mamoru Hosoda,"Mayumi Tanaka, Kazuya Nakai, Akemi Okamura",,
Jalsa,2022,Hindi,"Drama, Thriller","Abundantia Entertainment, T-Series",127,,Suresh Triveni,"Vidya Balan, Shefali Shah, Rohini Hattangadi",,
Gehraiyaan,2022,Hindi,"Romance, Drama","Dharma Productions, Viacom18 Studios, Jouska Films",148,,Shakun Batra,"Deepika Padukone, Siddhant Chaturvedi, Ananya Panday",,
Life is Beautiful!,2014,Hindi,,,0,,Manoj Amarnani,"Manoj Amarnani, Anokhi Dalvi, Raj Zutshi",22-08-2014,N/A
Tango Charlie,2005,Hindi,"Action, Adventure, Drama",,0,,Mani Shankar,"Ajay Devgn, Bobby Deol, Chitram Basha",25-03-2005,N/A
Tadap,2021,Hindi,"Action, Romance","Nadiadwala Grandson Entertainment, Fox Star Studios, Vertex Motion Pictures",126,,Milan Luthria,"Ahan Shetty, Tara Sutaria, Saurabh Shukla",03-12-2021,UA
Bird Idol,2010,Hindi,,,,,,,,
Badnaam Gali,2019,Hindi,"Drama, Comedy, Family",,95,,Ashwin Shetty,"Divyendu Sharma, Patralekhaa, Dolly Ahluwalia",,
Aalaap,2012,Hindi,Drama,,116,,Manish Manikpuri,"Amit Purohit, Abhimanyu Singh, Vijay Raaz",27-07-2012,N/A
Chingaari,2006,Hindi,"Drama, Romance",,160,,Kalpana Lajmi,"Sushmita Sen, Mithun Chakraborty, Ila Arun",,
Deshdrohi,2008,Hindi,"Action, Crime, Thriller",,139,,Jagdish A. Sharma,"Kamaal Rashid Khan, Gracy Singh, Hrishitaa Bhatt",14-11-2008,N/A
Jhootha Hi Sahi,2010,Hindi,"Drama, Romance",,142,,Abbas Tyrewala,"Paakhi A. Tyrewala, John Abraham, Manasi Scott",22-10-2010,N/A
Housefull,2010,Hindi,"Comedy, Romance",Nadiadwala Grandson Entertainment,135,"29,22,50,000",Sajid Khan,"Akshay Kumar, Arjun Rampal, Riteish Deshmukh",30-04-2010,UA
Utt Pataang,2011,Hindi,"Comedy, Romance",,96,,Srikanth V. Velagaleti,"Vinay Pathak, Mahie Gill, Saurabh Shukla",04-02-2011,N/A
Toilet: Ek Prem Katha,2017,Hindi,"Comedy, Drama, Romance","KriArj Entertainment, Grazing Goat Pictures, Friday Filmworks, Abundantia Entertainment, Plan C Studios",155,"30,89,50,000",Shree Narayan Singh,"Akshay Kumar, Bhumi Pednekar, Anupam Kher",11-08-2017,UA
Bansuri: The Flute,2021,Hindi,Drama,,108,,Hari Viswanath,"Anurag Kashyap, Rituparna Sengupta, Upendra Limaye",16-04-2021,N/A
Family of Thakurganj,2019,Hindi,"Drama, Action","Pen Studios, Lovely World Entertainment",127,,Manoj Jha,"Jimmy Shergill, Mahie Gill, Saurabh Shukla",19-07-2019,UA
Heroes,2008,Hindi,"Action, Adventure, Comedy",,140,"41,75,00,000",Samir Karnik,"Salman Khan, Preity Zinta, Sunny Deol",24-10-2008,N/A
Luv Ka The End,2011,Hindi,"Comedy, Drama",Y-Films,106,,Bumpy,"Shraddha Kapoor, Taha Shah Badussha, Errol Marks",06-05-2011,U
Jo Hum Chahein,2011,Hindi,Romance,,0,,Pawan Gill,"Sunny Gill, Simran Kaur Mundi, Alyy Khan",,
Apna Asmaan,2007,Hindi,"Drama, Science Fiction",,110,,Kaushik Roy,"Irrfan Khan, Shobana, Rajat Kapoor",07-09-2007,N/A
M Cream,2016,Hindi,"Adventure, Drama, Comedy",,114,,Agneya Singh,"Tom Alter, Raaghav Chanana, Ira Dubey",22-07-2016,N/A
Phata Poster Nikhla Hero,2013,Hindi,"Action, Comedy",Tips Industries,146,,Rajkumar Santoshi,"Shahid Kapoor, Ileana D'Cruz, Padmini Kolhapure",20-09-2013,U
Ki & Ka,2016,Hindi,"Drama, Romance, Action","Dhiraj Motion Pictures, Deepak Tijori Films, Focus Motion Pictures",128,,Deepak Tijori,"Kajal Aggarwal, Randeep Hooda, Anil George",10-06-2016,UA
Dharm,2007,Hindi,"Drama, History",WSG Pictures,105,,Bhavna Talwar,"Pankaj Kapur, Supriya Pathak, Hrishitaa Bhatt",08-06-2007,U
Nasha,2013,Hindi,"Drama, Romance, Thriller",Eagle Home Entertainment,120,,Amit Saxena,"Poonam Pandey, Shivam Patil, Ranbir Chakma",22-07-2013,A
Super K â The Movie,2011,Hindi,,,,,,,,
Victory,2009,Hindi,,"Walkwater Media, Victory Moving Pictures",150,,,"Harman Baweja, Amrita Rao, Anupam Kher",,
Bloody Daddy,2023,Hindi,"Action, Crime, Thriller","AAZ Films, Offside Entertainment, Jio Studios, The Vermillion World",122,,Ali Abbas Zafar,"Shahid Kapoor, Ronit Roy, Rajeev Khandelwal",,
Tu Jhoothi Main Makkaar,2023,Hindi,"Comedy, Romance, Family","T-Series, LUV Films, Yash Raj Films, Film Madrid, MFDC",159,,Luv Ranjan,"Ranbir Kapoor, Shraddha Kapoor, Anubhav Singh Bassi",08-03-2023,UA
Hisss,2010,Hindi,"Fantasy, Horror, Thriller","Split Image Pictures, Venus Records & Tapes",98,"83,50,00,000",Jennifer Lynch,"Mallika Sherawat, Irrfan Khan, Jeff Doucette",,
Tathastu,2006,Hindi,Drama,Karma Entertainment,113,,Anubhav Sinha,"Sanjay Dutt, Ameesha Patel, Jaya Prada",13-05-2006,N/A
Trapped,2017,Hindi,"Thriller, Drama","Reliance Entertainment, Phantom Films",105,,Vikramaditya Motwane,"Rajkummar Rao, Geetanjali Thapa, Khushboo Upadhyay",17-03-2017,N/A
Shaadi No. 1,2005,Hindi,Comedy,,129,,David Dhawan,"Fardeen Khan, Zayed Khan, Sharman Joshi",22-08-2005,N/A
Life in a... Metro,2007,Hindi,"Drama, Romance",UTV Motion Pictures,132,"9,18,50,000",Anurag Basu,"Kay Kay Menon, Shilpa Shetty Kundra, Konkona Sen Sharma",11-05-2007,A
Ajji,2017,Hindi,"Thriller, Crime",Yoodlee Films,104,,Devashish Makhija,"Sushama Deshpande, Sharvani Suryavanshi, Smita Tambe",24-11-2017,UA
